[
  {
    "id": "BOX-2026-001",
    "year": 2026,
    "topic": "box_detection",
    "category": "income_classification",
    "user_types": [
      "all"
    ],
    "condition": {
      "required": {
        "has_zzp_profit_or_employment_income": true
      },
      "exclusions": {}
    },
    "result": {
      "type": "requirement",
      "value": "Box 1 always applies to residents with work or business income",
      "unit": "string"
    },
    "plain_nl": "Iedereen met inkomen uit werk of eigen bedrijf betaalt belasting in Box 1.",
    "plain_en": "Everyone with income from employment or a business pays tax in Box 1.",
    "plain_fa": "هر کسی که درآمد از کار یا کسب‌وکار داشته باشد مشمول مالیات باکس ۱ می‌شود.",
    "source_url": "https://www.belastingdienst.nl/wps/wcm/connect/bldcontentnl/belastingdienst/prive/aangifte_doen/aangifte_ib/",
    "tags": [
      "box1",
      "income_classification",
      "basics"
    ],
    "effective_from": "2026-01-01",
    "effective_until": null,
    "verification_status": "verified",
    "last_checked": "2026-01-01"
  },
  {
    "id": "BOX-2026-002",
    "year": 2026,
    "topic": "box_detection",
    "category": "income_classification",
    "user_types": [
      "all"
    ],
    "condition": {
      "required": {
        "shareholder_percentage_gte": 5
      },
      "optional": {
        "company_type": "BV"
      }
    },
    "result": {
      "type": "requirement",
      "value": "Box 2 applies",
      "unit": "string"
    },
    "plain_nl": "Box 2 geldt als je 5% of meer van de aandelen van een vennootschap hebt.",
    "plain_en": "Box 2 applies if you own 5% or more of a company's shares.",
    "plain_fa": "باکس ۲ زمانی اعمال می‌شود که ۵٪ یا بیشتر سهام یک شرکت (مانند BV) را در اختیار داشته باشید.",
    "source_url": "https://www.belastingdienst.nl/wps/wcm/connect/bldcontentnl/belastingdienst/prive/vermogen_en_aanmerkelijk_belang/aanmerkelijk_belang/",
    "tags": [
      "box2",
      "aanmerkelijk_belang",
      "income_classification"
    ],
    "effective_from": "2026-01-01",
    "effective_until": null,
    "verification_status": "verified",
    "last_checked": "2026-01-01"
  },
  {
    "id": "BOX-2026-003",
    "year": 2026,
    "topic": "box_detection",
    "category": "income_classification",
    "user_types": [
      "all"
    ],
    "condition": {
      "required": {
        "net_assets_above_exemption": true
      },
      "optional": {
        "asset_types": [
          "savings",
          "investments",
          "second_property",
          "crypto"
        ]
      }
    },
    "result": {
      "type": "threshold",
      "value": 59357,
      "unit": "EUR"
    },
    "plain_nl": "Box 3 geldt als je vermogen (spaargeld + beleggingen − schulden) meer is dan €59.357 per persoon.",
    "plain_en": "Box 3 applies if your net assets exceed €59,357 per person (doubled for tax partners).",
    "plain_fa": "باکس ۳ زمانی اعمال می‌شود که دارایی خالص شما (پس‌انداز + سرمایه‌گذاری منهای بدهی) از مبلغ معافیت ۵۹٬۳۵۷ یورو (به ازای هر نفر) تجاوز کند.",
    "source_url": "https://www.belastingdienst.nl/wps/wcm/connect/bldcontentnl/belastingdienst/prive/vermogen_en_aanmerkelijk_belang/vermogen/",
    "tags": [
      "box3",
      "savings",
      "investments",
      "income_classification"
    ],
    "effective_from": "2026-01-01",
    "effective_until": null,
    "verification_status": "verified",
    "last_checked": "2026-01-01"
  },
  {
    "id": "BR1-2026-001",
    "year": 2026,
    "topic": "box1_brackets",
    "category": "tax_rates",
    "user_types": [
      "all"
    ],
    "condition": {
      "required": {
        "taxable_income_box1_range": [
          0,
          38883
        ],
        "below_aow_age": true
      }
    },
    "result": {
      "type": "rate",
      "value": 35.75,
      "unit": "percent",
      "formula": "taxable_income * 0.3575",
      "breakdown": {
        "income_tax": 8.1,
        "aow_premium": 17.9,
        "wlz_premium": 9.65,
        "anw_premium": 0.1
      }
    },
    "plain_nl": "Over de eerste €38.883 van je belastbaar inkomen betaal je 35,75% belasting + premies. Dit is inclusief AOW (17,90%), WLZ (9,65%) en ANW (0,10%).",
    "plain_en": "The first €38,883 of taxable income is taxed at 35.75%, which includes social insurance premiums.",
    "plain_fa": "اولین ۳۸٬۸۸۳ یورو درآمد مشمول مالیات با نرخ ۳۵.۷۵٪ مالیات می‌گیرد. این نرخ شامل حق بیمه اجتماعی (AOW 17.90٪ + WLZ 9.65٪ + ANW 0.10٪) است.",
    "source_url": "https://www.belastingdienst.nl/wps/wcm/connect/bldcontentnl/belastingdienst/prive/inkomstenbelasting/heffingskortingen_boxen_tarieven/tarieven_boxen/",
    "tags": [
      "box1",
      "bracket1",
      "tax_rate",
      "social_insurance"
    ],
    "effective_from": "2026-01-01",
    "effective_until": null,
    "ai_prompt_hint": "Surface this when user asks about tax rate or to calculate taxes on income under €38,883",
    "verification_status": "verified",
    "last_checked": "2026-01-01"
  },
  {
    "id": "BR1-2026-002",
    "year": 2026,
    "topic": "box1_brackets",
    "category": "tax_rates",
    "user_types": [
      "all"
    ],
    "condition": {
      "required": {
        "taxable_income_box1_range": [
          38883,
          78426
        ],
        "at_or_above_aow_age": true
      }
    },
    "result": {
      "type": "rate",
      "value": 37.56,
      "unit": "percent",
      "formula": "(taxable_income - 38883) * 0.3756"
    },
    "plain_nl": "Voor belastingplichtigen die de AOW-leeftijd hebben bereikt geldt een tweede schijf van 37,56% over €38.884 tot €78.426.",
    "plain_en": "Taxpayers who have reached AOW retirement age have a second bracket of 37.56%.",
    "plain_fa": "برای مالیات‌دهندگانی که به سن بازنشستگی AOW رسیده‌اند، براکت دوم ۳۷.۵۶٪ اعمال می‌شود.",
    "source_url": "https://www.belastingdienst.nl/wps/wcm/connect/bldcontentnl/belastingdienst/prive/inkomstenbelasting/heffingskortingen_boxen_tarieven/tarieven_boxen/",
    "tags": [
      "box1",
      "bracket2",
      "aow_age",
      "tax_rate"
    ],
    "effective_from": "2026-01-01",
    "effective_until": null,
    "ai_prompt_hint": "Only surface for users who confirm they have reached AOW age",
    "verification_status": "verified",
    "last_checked": "2026-01-01"
  },
  {
    "id": "BR1-2026-003",
    "year": 2026,
    "topic": "box1_brackets",
    "category": "tax_rates",
    "user_types": [
      "all"
    ],
    "condition": {
      "required": {
        "taxable_income_box1_above": 78426
      }
    },
    "result": {
      "type": "rate",
      "value": 49.5,
      "unit": "percent",
      "formula": "(taxable_income - 78426) * 0.495"
    },
    "plain_nl": "Over het deel van je belastbaar inkomen boven €78.426 betaal je 49,50% inkomstenbelasting.",
    "plain_en": "Income above €78,426 is taxed at 49.50% — income tax only (no social premiums at this level).",
    "plain_fa": "درآمد مشمول مالیات بالای ۷۸٬۴۲۶ یورو با نرخ ۴۹.۵۰٪ مالیات می‌گیرد.",
    "source_url": "https://www.belastingdienst.nl/wps/wcm/connect/bldcontentnl/belastingdienst/prive/inkomstenbelasting/heffingskortingen_boxen_tarieven/tarieven_boxen/",
    "tags": [
      "box1",
      "bracket3",
      "high_income",
      "tax_rate"
    ],
    "effective_from": "2026-01-01",
    "effective_until": null,
    "notes": "Social insurance premiums (volksverzekeringen) do not apply above bracket 1 ceiling for people below AOW age.",
    "verification_status": "verified",
    "last_checked": "2026-01-01"
  },
  {
    "id": "ZA-2026-001",
    "year": 2026,
    "topic": "zelfstandigenaftrek",
    "category": "deductions",
    "user_types": [
      "zzp"
    ],
    "condition": {
      "required": {
        "is_entrepreneur_for_tax": true,
        "hours_worked_in_business_gte": 1225,
        "has_profit": true
      },
      "optional": {
        "at_aow_age": false
      },
      "exclusions": {
        "below_profit_threshold": false
      }
    },
    "result": {
      "type": "amount",
      "value": 1200,
      "unit": "EUR",
      "ceiling": 1200,
      "formula": "min(1200, profit_before_deductions)",
      "note_aow_age": "If taxpayer reached AOW age on 1 Jan 2026: deduction is 50% = €600"
    },
    "plain_nl": "Als ondernemer met 1.225+ uur per jaar mag je €1.200 aftrekken van je winst (niet van je belasting). Bedrag daalt jaarlijks.",
    "plain_en": "Self-employed entrepreneurs working 1,225+ hours/year may deduct €1,200 from their profit.",
    "plain_fa": "کارآفرینانی که ۱٬۲۲۵ ساعت یا بیشتر در سال کار می‌کنند می‌توانند ۱٬۲۰۰ یورو از سود خود کسر کنند.",
    "source_url": "https://www.belastingdienst.nl/wps/wcm/connect/bldcontentnl/belastingdienst/zakelijk/winst/ondernemersaftrek/zelfstandigenaftrek/",
    "tags": [
      "zelfstandigenaftrek",
      "ondernemersaftrek",
      "zzp",
      "deduction",
      "urencriterium"
    ],
    "effective_from": "2026-01-01",
    "effective_until": null,
    "supersedes": "ZA-2025-001",
    "notes": "Phase-out: €6,670 (2021) → €4,806 (2022) → €3,943 (2023) → €3,141 (2024) → €2,470 (2025) → €1,200 (2026) → €900 (2027)",
    "ai_prompt_hint": "Always check urencriterium (1225 hrs) before applying this deduction",
    "verification_status": "verified",
    "last_checked": "2026-01-01"
  },
  {
    "id": "SA-2026-001",
    "year": 2026,
    "topic": "startersaftrek",
    "category": "deductions",
    "user_types": [
      "zzp"
    ],
    "condition": {
      "required": {
        "is_entrepreneur_for_tax": true,
        "hours_worked_in_business_gte": 1225,
        "not_entrepreneur_in_at_least_1_of_last_5_years": true,
        "used_startersaftrek_fewer_than_3_times": true
      }
    },
    "result": {
      "type": "amount",
      "value": 2123,
      "unit": "EUR",
      "formula": "min(2123, profit - zelfstandigenaftrek)"
    },
    "plain_nl": "Starters mogen bovenop de zelfstandigenaftrek nog €2.123 extra aftrekken. Let op: 2026 is het LAATSTE jaar van de startersaftrek — wordt in 2027 afgeschaft.",